{"artifacts":[{"kind":"request","relative_path":"runs/run_1ec64efe0921412a/artifacts/request.json","sha256":"446652f3958ae77684fcfd02146302dcecf0781fed58b94673724e3503611159"},{"kind":"source_manifest","relative_path":"runs/run_1ec64efe0921412a/artifacts/source-manifest.json","sha256":"882f18c5526903c0c80460b59c6d2f63b4d2cc2384cd0eda134210c986063505"},{"kind":"task_manifest","relative_path":"runs/run_1ec64efe0921412a/artifacts/task-manifest.json","sha256":"1444fd588d4e7d6a0dbb0a4d97179116caeaa0b7b471694980d53213c3b32daf"},{"kind":"event_export","relative_path":"runs/run_1ec64efe0921412a/artifacts/events.ndjson","sha256":"8c4e3a06e108e68393f3513a556fde7b294507392acbbff6526b2fd7d6688bea"}],"created_at":"2026-09-26T19:58:49.111165+00:00","execution_mode":"development","queue_summary":{"discovered":1,"duplicates":0,"excluded":0,"remaining":0,"selected":1},"run_id":"run_1ec64efe0921412a","schema_version":"1.0","source":{"baseline_commit":"3079a4063aacc18bcaf2c79b894c0ca90685317b","content_tree_sha256":"23ad55adc61b4c4efc2ac925931e15a035f5e9eb9238942dd7a1b4614d497e17","upstream_commit":"31e4a92d45e3f0658cc156171449ca29dfd3b6ee"},"status":"PREPARED","task_mode":"single_issue","tasks":[{"ordinal":0,"state":"QUEUED","task_id":"tsk_5852823a73e24c34"}],"workspace":{"relative_root":"runs/run_1ec64efe0921412a/workspace","workspace_id":"wsp_d0bd13f140df4792","writable":false}}